incursion<br temporary invasion. The nightly incursions and hit-and-run raids of our neighbors across the border tried the patience of the country to the point where we decided to retaliate in force.	
indefatigable<br tireless. Although the effort of taking out the garbage tired Wayne out for the entire morning, when it came to partying, he was indefatigable.	
indelible	ADJ. not able to be erased. The indelible ink left a permanent mark on my shirt. Young Bill Clinton's meeting with President Kennedy made an indelible impression on the youth.
indentation	N. notch; deep recess. You can tell one tree from another by examining their leaves and noting the dif¬ferences in the indentations along the edges of the leaves. indent,V.
indenture	V. bind as servant or apprentice to master. Many immigrants could come to America only after they had indentured themselves for several years. also N.
indeterminate	ADJ. uncertain; not clearly fixed; indefinite. That interest rates shall rise appears certain; when they will do so, however, remains indeterminate.
indicative	ADJ. suggestive; implying. A lack of appetite may be indicative of a major mental or physical disorder.
indices<br signs; indications. Many college admissions officers believe that SAT scores and high school grades are the best indices of a student's potential to succeed in col¬lege. N. SG. index.	
indict	V. charge. The district attorney didn't want to indict the suspect until she was sure she had a strong enough case to convince a jury. indictment, N.
indifferent	ADJ. unmoved or unconcerned by; mediocre. Because Ann felt no desire to marry, she was indifferent to Carl's constant proposals. Not only was she indifferent to him personally, but she felt that, given his general silliness, he would make an indifferent husband.
indigenous to	ADJ. native. Cigarettes are made of tobacco, a plant indigenous to the New World.
indigent	ADJ. poor; destitute. Someone who is truly indi¬gent can't even afford to buy a pack of cigarettes. [Don't mix up indigent and indigenous. See previous sentence.]
indignation	N. anger at an injustice. He felt indignation at the ill-treatment of helpless animals.
indignity	N. offensive or insulting treatment. Although he seemed to accept cheerfully the indignities heaped upon him, he was inwardly very angry.
indiscretion	N. lack of tactfulness or sound judgment. Ter¬rified that the least indiscretion could jeopardize his political career, the novice politician never uttered an unguarded word. indiscreet,ADJ.
indiscriminate<br choosing at random; confused. She disapproved of her son's indiscriminate television viewing and decided to restrict him to educational programs.	
indisputable	ADJ. too certain to be disputed. In the face of these indisputable statements, I withdraw my complaint.
indissoluble	ADJ. permanent. The indissoluble bonds of marriage are all too often being dissolved.
indoctrinate	V. instruct in a doctrine or ideology. Cuban¬Americans resisted sending Elian Gonzalez back to Cuba because he would be indoctrinated there with Communist principles.
indolent<br lazy. Couch potatoes lead an indolent life lying back on their Lazyboy recliners watching Tv. indo-lence, N.	
indomitable<br unconquerable; unyielding. Focusing on her game despite all her personal problems, tennis cham¬pion Steffi Graf proved she had an indomitable will to win.	
indubitable	ADJ. unable to be doubted; unquestionable. Auditioning for the chorus line, Molly was an indubitable hit: the director fired the leading lady and hired Molly in her place!
induce	V. persuade; bring about. After the quarrel, Tina said nothing could induce her to talk to Tony again. induce¬ment, N.
indulgent	ADJ. humoring; yielding; lenient. Jay's mom was excessively indulgent she bought him every Nintendo car¬tridge and video game on the market. She indulged Jay so much, she spoiled him rotten.
industrious	ADJ. diligent; hard-working. Look busy when the boss walks by your desk; it never hurts to appear indus¬trious. industry, N.
inebriated<br habitually intoxicated; drunk. Abe was ine¬briated more often than he was sober. Because of his ine¬briety, he was discharged from his job as a bus driver.	
ineffable<br unutterable; cannot be expressed in speech. Such ineffable joy must be experienced; it cannot be described.	
ineffectual	ADJ. not effective; weak. Because the candi¬date failed to get across his message to the public, his campaign was ineffectual.
inefficacious	ADJ. not effective; unable to produce a desired result. All Lois's coaxing and urging was ineffica¬cious: Clark still refused to join her and Superman for din¬ner. inefficacy, N.
inept	ADJ. lacking skill; unsuited; incompetent. The inept glovemaker was all thumbs.
inequity	N. unfairness. In demanding equal pay for equal work, women protest the basic inequity of a system that gives greater financial rewards to men.
inert<br inactive; lacking power to move. &quot;Get up, you lazybones,&quot; she cried to her husband, who lay in bed inert. inertia, N.	
inevitable	ADJ. unavoidable. Though death and taxes are both supposedly inevitable, some people avoid paying taxes for years.
inexorable	ADJ. relentless; unyielding; implacable. After listening to the pleas for clemency, the judge was inex¬orable and gave the convicted man the maximum punish¬ment allowed by law.
infallible	ADJ. unerring. We must remember that none of us is infallible; we all make mistakes.
infamous	ADJ. notoriously bad. Charles Manson and Jef¬frey Dahmer are both infamous killers.
infantile	ADJ. childish. When will he outgrow such infantile behavior?
infer	V. deduce; conclude. From the students' glazed looks, it was easy for me to infer that they were bored out of their minds. inference, N.
infernal	ADJ. pertaining to hell; devilish. Batman was baf¬fled: he could think of no way to hinder the Joker's infernal scheme to destroy the city.
infidel<br unbeliever. The Saracens made war against the infidels.	
infiltrate	V. pass into or through; penetrate (an organiza¬tion) sneakily. In order to be able to infiltrate enemy lines at night without being seen, the scouts darkened their faces and wore black coveralls. infiltrator, N.
infinitesimal	ADJ. very small. In the twentieth century, physi¬cists have made their greatest discoveries about the charac¬teristics of infinitesimal objects like the atom and its parts.
infirmity	N. weakness. Her greatest infirmity was lack of willpower.
inflated	ADJ. exaggerated; pompous; enlarged (with air or gas). His claims about the new product were inflated, it did not work as well as he had promised.
influx	N. flowing into. The influx of refugees into the coun¬try has taxed the relief agencies severely.
informal	ADJ. absence of ceremony; casual. The English teacher preferred informal discussions to prepared lectures.
infraction	N. >
infuriate	V. enrage; anger. Her big brother's teasing always infuriated Margaret; no matter how hard she tried to keep her temper, he always got her goat.
infusion	N. act of introducing or instilling a quality; liquid solution. The rookie quarterback brought an infusion of new life and vigor to the tired team. infuse,V.
ingenious	ADJ. clever; resourceful. Kit admired the inge¬nious way that her computer keyboard opened up to reveal the built-in CD-ROM below. ingenuity, N.
Word List 26	ingenue-invigorate
ingenue	N. an artless girl; an actress who plays such parts. Although she was forty, she still insisted that she be cast as an ingenue and refused to play more mature roles.
ingenuous<br naive and trusting; young; unsophisti¬cated. The woodsman had not realized how ingenuous Lit¬tle Red Riding Hood was until he heard that she had gone off for a walk in the woods with the Big Bad Wolf.	
ingrained	ADJ. deeply established; firmly rooted. Try as they would, the missionaries were unable to uproot the ingrained superstitions of the natives.
ingrate<br ungrateful person. That ingrate Bob sneered at the tie I gave him.	
ingratiate	V. become popular with. He tried to ingratiate himself into her parents' good graces.
inherent	ADJ. firmly established by nature or habit. Katya's inherent love of justice caused her to champion anyone she considered treated unfairly by society.
inhibit	V. restrain; retard or prevent. Only two things inhib¬ited him from taking a punch at Mike Tyson: Tyson's left hook, and Tyson's right jab. The protective undercoating on my car inhibits the formation of rust.
inimical to<br unfriendly; hostile; harmful; detrimental. I've always been friendly to Martha. Why is she so inimical to me?	
inimitable<br matchless; not able to be imitated. We admire Auden for his inimitable use of language; he is one of a kind.	
iniquitous<br wicked; immoral; unrighteous. Whether or not King Richard III was responsible for the murder of the two young princes in the Tower, it was an iniquitous deed. iniquity, N.	
initiate	V. begin; originate; receive into a group. The col¬lege is about to initiate a program in reducing math anxiety among students.
injurious	ADJ. harmful. Smoking cigarettes can be injurious to your health.
inkling	N. hint. This came as a complete surprise to me as I did not have the slightest inkling of your plans.
innate	ADJ. inborn. Mozart's parents soon recognized young Wolfgang's innate talent for music.
innocuous	ADJ. harmless. An occasional glass of wine with dinner is relatively innocuous and should have no ill effect on you.
innovation	N. change; introduction of something new. Although Richard liked to keep up with all the latest techno¬logical innovations, he didn't always abandon tried and true techniques in favor of something new. innovate,V.
innovative	ADJ. novel; introducing a change. The estab¬lishment of our SAT I computer data base has enabled us to come up with some innovative tactics for doing well on the SAT.
innuendo<br hint; insinuation. I can defend myself against direct accusations; innuendos and oblique attacks on my character are what trouble me.	
inopportune	ADJ. untimely; poorly chosen. A rock concert is an inopportune setting for a quiet conversation.
inordinate	ADJ. unrestrained; excessive. She had an inor¬dinate fondness for candy, eating two or three boxes in a single day.
inquisitor	N. questioner (especially harsh); investigator. Fearing being grilled ruthlessly by the secret police, Masha faced her inquisitors with trepidation.
insalubrious	ADJ. unwholesome; not healthful. The mos¬quito-ridden swamp was an insalubrious place, a breeding ground for malarial contagion.
insatiable for	ADJ. not easily satisfied; unquenchable; greedy. David's appetite for oysters was insatiable: he could easily eat four dozen at a single sitting.
inscrutable	"ADJ. impenetrable; not readily understood; mysterious. Experienced poker players try to keep their expressions inscrutable, hiding their reactions to the cards behind a so-called ""poker face."""
insensible<br unconscious; unresponsive. Sherry and I are very different; at times when I would be covered with embarrassment, she seems insensible to shame.	
insidious	ADJ. treacherous; stealthy; sly. The fifth column is insidious because it works secretly within our territory for our defeat.
insightful	ADJ. discerning; perceptive. Sol thought he was very insightful about human behavior, but he was actually clueless as to why people acted the way they did.
insinuate	V. hint; imply; creep in. When you said I looked robust, did you mean to insinuate that I'm getting fat?
insipid<br >The incipient worms are pretty much insipid in taste	
insolence	N. impudent disrespect; haughtiness. How dare you treat me so rudely! The manager will hear of your inso¬lence. insolent,ADJ.
insolvent	ADJ. bankrupt; unable to repay one's debts. Although young Lord Widgeon was insolvent, he had no fear of being thrown into debtors' prison, for he was sure that if his creditors pressed him for payment his wealthy parents would repay what he owed. insolvency, N.
insomnia	N. wakefulness; inability to sleep. He refused to join us in a midnight cup of coffee because he claimed it gave him insomnia.
instigate<br urge; start; provoke. Rumors of police corrup¬tion led the mayor to instigate an investigation into the department's activities.	
insubordination<br disobedience; rebelliousness. At the slightest hint of insubordination from the sailors of the Bounty, Captain Bligh had them flogged; finally, they mutinied.	
insubstantial	ADJ. lacking substance; insignificant; frail. His hopes for a career in acting proved insubstantial; no one would cast him, even in an insubstantial role.
insularity	N. narrow-mindedness; isolation. The insularity of the islanders manifested itself in their suspicion of anything foreign. insular,ADJ.
insulated	ADJ. set apart; isolated. A well-to-do bachelor, James spent his money freely, insulated from the cares of his friends, who had families to support.
insuperable	ADJ. insurmountable; unbeatable. Though the odds against their survival seemed insuperable, the Apollo 13 astronauts reached earth safely.
insurgent	ADJ. rebellious. Because the insurgent forces had occupied the capital and had gained control of the rail¬way lines, several of the war correspondents covering the uprising predicted a rebel victory.
insurmountable	ADJ. overwhelming; unbeatable; insupera¬ble. Faced by almost insurmountable obstacles, the mem¬bers of the underground maintained their courage and will to resist.
insurrection	N. rebellion; uprising. In retrospect, given how badly the British treated the American colonists, the even¬tual insurrection seems inevitable.
intangible	ADJ. not able to be perceived by touch; vague. Though the financial benefits of his Oxford post were mea¬ger, Lewis was drawn to it by its intangible rewards: pres-tige, intellectual freedom, the fellowship of his peers.
integral	ADJ. complete; necessary for completeness. Phys¬ical education is an integral part of our curriculum; a sound mind and a sound body are complementary.
integrate	V. make whole; combine; make into one unit. She tried to integrate all their activities into one program.
integrity	N. uprightness; wholeness. Lincoln, whose per¬sonal integrity has inspired millions, fought a civil war to maintain the integrity of the Republic, that these United States might remain undivided for all time.
intellect	N. higher mental powers. He thought college would develop his intellect.
intelligentsia	N. the intelligent and educated classes [often used derogatorily]. She preferred discussions about sports and politics to the literary conversations of the intelligentsia.
intemperate<br immoderate; excessive; extreme. In a temper, Tony refused to tone down his intemperate remarks.	
inter	V. bury. They are going to inter the body tomorrow at Broadlawn Cemetery.
interim<br meantime. The company will not consider our proposal until next week; in the interim, let us proceed as we have in the past.	
interloper<br intruder; unwanted meddler. The merchant thought of his competitors as interlopers who were stealing away his trade.	
interment<br burial. Interment will take place in the church cemetery at 2 P.M. Wednesday.	
interminable	ADJ. endless. Although his speech lasted for only twenty minutes, it seemed interminable to his bored audience.
intermittent	ADJ. periodic; on and off. The outdoor wed¬ding reception had to be moved indoors to avoid the inter¬mittent showers that fell on and off all afternoon.
interrogate	V. question closely; cross-examine. Knowing that the Nazis would interrogate him about his background, the secret agent invented a cover story that would help him meet their questions.
intervene	V. come between. When two close friends get into a fight, be careful if you try to intervene; they may join forces to gang up on you.
intimacy	N. closeness, often affectionate; privacy; familiar¬ity. In a moment of rare intimacy, the mayor allowed the reporters a glimpse of his personal feelings about his fam¬ily. intimate,ADJ.
intimate	V. hint; suggest. Was Dick intimating that Jane had bad breath when he asked if she'd like a breath mint?
intimidate	V. frighten. I'll learn karate and then those big bullies won't be able to intimidate me any more.
intractable	ADJ. unruly; stubborn; unyielding. Charlie Brown's friend Pigpen was intractable: he absolutely refused to take a bath.
intransigence<br refusal of any compromise; stubborn¬ness. The negotiating team had not expected such intransi¬gence from the striking workers, who rejected any hint of a compromise. intransigent,ADJ.	
intrepid	ADJ. fearless. For her intrepid conduct nursing the wounded during the war, Florence Nightingale was honored by Queen Victoria.
intricate	ADJ. complex; knotty; tangled. Philip spent many hours designing mazes so intricate that none of his class¬mates could solve them. intricacy, N.
intrinsic	ADJ. essential; inherent; built-in. Although my grandmother's china has little intrinsic value, I shall always cherish it for the memories it evokes.
introspective	ADJ. looking within oneself. Though young Francis of Assisi led a wild and worldly life, even then he had introspective moments during which he examined his soul. introvert N. one who is introspective; inclined to think more about oneself. In his poetry, he reveals that he is an intro¬vert by his intense interest in his own problems. alsoV.
intrude	V. trespass; enter as an uninvited person. She hes¬itated to intrude on their conversation.
intuition	N. immediate insight; power of knowing without reasoning. Even though Tony denied that anything was wrong, Tina trusted her intuition that something was bother¬ing him. intuitive,ADJ.
inundate	V. overwhelm; flood; submerge. This semester I am inundated with work: You should see the piles of paper¬work flooding my desk. Until the great dam was built, the waters of the Nile used to inundate the river valley like clockwork every year.
inured<br accustomed; hardened. She became inured to the Alaskan cold.	
invalidate	V. weaken; destroy. The relatives who received little or nothing sought to invalidate the will by claiming that the deceased had not been in his right mind when he had signed the document.
invasive	ADJ. tending to spread aggressively; intrusive. Giving up our war with the invasive blackberry vines that had taken over the back yard, we covered the lawn with concrete. invade,V.
invective<br abuse. He had expected criticism but not the invective that greeted his proposal. inveigh,V.	
inverse	ADJ. opposite. There is an inverse ratio between the strength of light and its distance.
invert	V. turn upside down or inside out. When he inverted his body in a handstand, he felt the blood rush to his head. inveterate ADJ. deep-rooted; habitual. An inveterate smoker, Bob cannot seem to break the habit, no matter how hard he tries.
invidious<br designed to create ill will or envy. We disre¬garded her invidious remarks because we realized how jealous she was.	
invigorate	V. energize; stimulate. A quick dip in the pool invigorated Meg, and with renewed energy she got back to work.
Word List 27	invincible-laggard'
invincible	ADJ. unconquerable. Superman is invincible.
inviolable	ADJ. secure from corruption, attack, or violation; unassailable. Batman considered his oath to keep the peo¬ple of Gotham City inviolable: nothing on earth could make him break this promise.
invocation	N. prayer for help; calling upon as a reference or support. The service of Morning Prayer opens with an invocation during which we ask God to hear our prayers.
invoke<br call upon; ask for. She invoked her advisor's aid in filling out her financial aid forms.	
invulnerable	ADJ. incapable of injury. Achilles was invul¬nerable except in his heel.
iota	N. very small quantity. She hadn't an iota of common sense.
irascible	ADJ. irritable; easily angered. Miss Minchin's iras¬cible temper intimidated the younger schoolgirls, who feared she'd burst into a rage at any moment.
irate	ADJ. angry. When John's mother found out he had overdrawn his checking account for the third month in a row, she was so irate she could scarcely speak to him.
ire<br anger. The waiter tried unsuccessfully to placate the ire of the diner who had found a cockroach in her soup.	
iridescent<br exhibiting rainbowlike colors. She admired the iridescent hues of the oil that floated on the surface of the water.	
irksome	ADJ. annoying; tedious. He found working on the assembly line irksome because of the monotony of the operation he had to perform. irk,V.
ironic	ADJ. resulting in an unexpected and contrary out¬come. It is ironic that his success came when he least wanted it.
irony	N. hidden sarcasm or satire; use of words that seem to mean the opposite of what they actually mean. Gradually his listeners began to realize that the excessive praise he was lavishing on his opponent was actually irony, he was in fact ridiculing the poor fool.
irrational	ADJ. illogical; lacking reason; insane. Many peo¬ple have such an irrational fear of snakes that they panic at the sight of a harmless garter snake.
irreconcilable	ADJ. incompatible; not able to be resolved. Because the separated couple were irreconcilable, the marriage counselor recommended a divorce.
irrefutable	ADJ. indisputable; incontrovertible; undeniable. No matter how hard I tried to find a good comeback for her argument, I couldn't think of one: her logic was irrefutable.
irrelevant	ADJ. not applicable; unrelated. No matter how irrelevant the patient's mumblings may seem, they give us some indications of what he has on his mind.
irremediable	ADJ. incurable; uncorrectable. The error she made was irremediable; she could see no way to repair it.
irreparable	ADJ. not able to be corrected or repaired. Your apology cannot atone for the irreparable damage you have done to her reputation.
irrepressible	ADJ. unable to be restrained or held back. My friend Kitty's curiosity was irrepressible: she poked her nose into everybody's business and just laughed when I warned her that curiosity killed the cat.
irreproachable	ADJ. blameless; impeccable. Homer's con¬duct at the office party was irreproachable; even Marge didn't have anything bad to say about how he behaved.
irresolute	ADJ. uncertain how to act; weak. Once you have made your decision, don't waver; a leader should never appear irresolute.
irretrievable	ADJ. impossible to recover or regain; irrepara¬ble. The left fielder tried to retrieve the ball, but it flew over the fence, bounced off a wall, and fell into the sewer: it was irretrievable.
irreverence	N. lack of proper respect. Some audience members were amused by the irreverence of the come¬dian's jokes about the Pope; others felt offended by his lack of respect for their faith. irreverent,ADJ.
irrevocable	"ADJ. unalterable; irreversible. As Sue dropped the ""Dear John"" letter into the mailbox, she suddenly had second thoughts and wanted to take it back, but she could not: her action was irrevocable."
itinerant	ADJ. wandering; traveling. He was an itinerant peddler and traveled through Pennsylvania and Virginia selling his wares. also N.
itinerary	N. plan of a trip. Disliking sudden changes in plans when she traveled abroad, Ethel refused to make any alterations in her itinerary.
jabber	V. chatter rapidly or unintelligibly. Why does the fel¬low insist on jabbering away in French when I can't under¬stand a word he says?
jaded	ADJ. fatigued; surfeited. He looked for exotic foods to stimulate his jaded appetite.
jargon	N. language used by a special group; technical ter¬minology; gibberish. The computer salesmen at the store used a jargon of their own that we simply couldn't follow; we had no idea what they were jabbering about.
jaundiced	ADJ. prejudiced (envious, hostile or resentful); yellowed. Because Sue disliked Carolyn, she looked at Car¬olyn's paintings with a jaundiced eye, calling them formless smears. Newborn infants afflicted with jaundice look slightly yellow: they have jaundiced skin.
jaunt<br trip; short journey. He took a quick jaunt to Atlantic City.	
jaunty	"ADJ. lighthearted; animated; easy and carefree. In An American in Paris, Gene Kelly sang and danced his way through ""Singing in the Rain"" in a properly jaunty style."
jeopardize	V. endanger; imperil; put at risk. You can't give me a D in chemistry: you'll jeopardize my chances of get¬ting into M.I.T. jeopardy, N.
jettison	V. throw overboard. In order to enable the ship to ride safely through the storm, the captain had to jettison much of his cargo.
jingoist	"N. extremely aggressive and militant patriot; warlike chauvinist. Always bellowing ""America first!,"" the congressman was such a jingoist you could almost hear the sabers rattling as he marched down the halls. jingoism, N."
jocose	"ADJ. given to joking. The salesman was so jocose that many of his customers suggested that he become a .,stand-up"" comic."
jocular	ADJ. said or done in jest. Although Bill knew the boss hated jokes, he couldn't resist making one jocular remark.
jollity	N. gaiety; cheerfulness. The festive Christmas dinner was a merry one, and old and young alike joined in the gen¬eral jollity.
jostle	V. shove; bump. In the subway he was jostled by the crowds.
jovial	ADJ. good-natured; merry. A frown seemed out of place on his invariably jovial face.
jubilation	N. rejoicing. There was great jubilation when the armistice was announced. jubilant,ADJ.
judicious	ADJ. sound in judgment; wise. At a key moment in his life, he made a judicious investment that was the foundation of his later wealth.
juncture<br crisis; joining point. At this critical juncture, let us think carefully before determining the course we shall follow.	
junta	N. group of men joined in political intrigue; cabal. As soon as he learned of its existence, the dictator ordered the execution of all of the members of the junta.
jurisprudence<br science of law. He was more a student of jurisprudence than a practitioner of the law.	
