provocative	ADJ. arousing anger or interest; annoying. In a typically provocative act, the bully kicked sand into the weaker man's face.
provoke	V. stir to anger; cause retaliation. In order to pre¬vent a sudden outbreak of hostilities, we must not provoke our foe. provocation, N; provocative,ADJ.
prowess	N. extraordinary ability; military bravery. Perform¬ing triple axels and double lutzes at the age of six, the young figure skater was world famous for her prowess on the ice.
proximity	N. nearness. Blind people sometimes develop a compensatory ability to sense the proximity of objects around them.
proxy	N. authorized agent. Please act as my proxy and vote for this slate of candidates in my absence.
prude<br excessively modest person. The X-rated film was definitely not for prudes, prudish,ADJ.	
prudent	ADJ. cautious; careful. A miser hoards money not because he is prudent but because he is greedy. prudence, N.
prune	V. cut away; trim. With the help of her editor, she was able to prune her overlong manuscript into publishable form.
prurient	ADJ. >To be prurient you cannot be prudent
pseudonym	N. pen name. Samuel Clemens' pseudonym was Mark Twain.
psyche	N. soul; mind. It is difficult to delve into the psyche of a human being.
pterodactyl	N. extinct flying reptile. The remains of ptero¬dactyls indicate that these flying reptiles had a wingspan of as much as twenty feet.
puerile<br childish. His puerile pranks sometimes offended his more mature friends.	
pugilist	N. boxer. The famous pugilist Cassius Clay changed his name to Muhammed Ali.
pugnacity	"N. combativeness; disposition to fight. ""Put up your dukes!"" he cried, making a fist to show his pugnacity. pugnacious,ADJ."
pulchritude	N. >That degree of pulchritude will win the admiration from even the harshest calpulter
pulverize	V. crush or grind into dust. Before sprinkling the dried herbs into the stew, Michael first pulverized them into a fine powder.
pummel	V. beat or pound with fists. Swinging wildly, Pam pummeled her brother around the head and shoulders.
punctilious	ADJ. laying stress on niceties of conduct or form; minutely attentive to fine points (perhaps too much so). Percy is punctilious about observing the rules of eti¬quette whenever Miss Manners invites him to stay. punctil¬iousness.N.
pundit	N. authority on a subject; learned person; expert. Some authors who write about SAT I as if they are pundits actually know very little about the test.
pungent	ADJ. stinging; sharp in taste or smell; caustic. The pungent odor of ripe Limburger cheese appealed to Simone but made Stanley gag.
punitive	ADJ. punishing. He asked for punitive measures against the offender.
puny	ADJ. insignificant; tiny; weak. Our puny efforts to stop the flood were futile.
purchase	N. firm grasp or footing. The mountaineer strug¬gled to get a proper purchase on the slippery rock. (sec¬ondary meaning)
purge	V. remove or get rid of something unwanted; free from blame or guilt; cleanse or purify. When the Communist government purged the party to get rid of members sus¬pected of capitalist sympathies, they sent the disloyal mem¬bers to labor camps in Siberia.
purported	ADJ. alleged; claimed; reputed or rumored. The purported Satanists sacrificing live roosters in the park turned out to be a party of Shriners holding a chicken barbecue.
purse	V. >Pursed the lips because her purse was stolen
purveyor	N. furnisher of foodstuffs; caterer. As purveyor of rare wines and viands, he traveled through France and Italy every year in search of new products to sell.
pusillanimous<br cowardly; fainthearted. You should be ashamed of your pusillanimous conduct during this dispute.	
putrid<br >That triden full of putrid meat has to be purified before it is returned to Posedon	
pyromaniac<br person with an insane desire to set things on fire. The detectives searched the area for the pyroma¬niac who had set these costly fires.	
quack	N. charlatan; impostor. Do not be misled by the exorbitant claims of this quack; he cannot cure you.
quadruped<br four-footed animal. Most mammals are quadrupeds.	
quaff	V. >Quaffed a quart of beer
quagmire	N. soft wet boggy land; complex or dangerous situation from which it is difficult to free oneself. Up to her knees in mud, Myra wondered how on earth she was going to extricate herself from this quagmire.
quail	V. >The quail quailed before the sight of the gawking hawk
quaint	ADJ. odd; old-fashioned; picturesque. Her quaint clothes and old-fashioned language marked her as an eccentric.
qualified	ADJ. b>to the theory!!!!!
qualms	N. misgivings; uneasy fears, especially about mat¬ters of conscience. I have no qualms about giving this assignment to Helen; I know she will handle it admirably.
quandary	N. >Quarantine King Lear, facing a loss of control, or release King Lear, inducing a epidemic? They a quite in a quandary
quarantine	N. isolation of person or ship to prevent spread of infection. We will have to place this house under quaran¬tine until we determine the exact nature of the disease. alsoV.
quarry	N. >
Word List 39	quay-recurrent
quay	N. dock; landing place. Because of the captain's carelessness, the ship crashed into the quay.
queasy<br >The queasy nature made it easy for him to quit a running bus on tortuous paths	
quell	V. extinguish; put down; quiet. Miss Minchin's demeanor was so stern and forbidding that she could quell any unrest among her students with one intimidating glance.
quench	V. douse or extinguish; assuage or satisfy. No matter how much water the hiker drank, she could not quench her thirst.
querulous	ADJ. fretful; whining. Even the most agreeable toddlers can begin to act querulous if they miss their nap.
query	"N. inquiry; question. In her column ""Ask Beth,"" the columnist invites young readers to send her their queries about life and love."
quibble<br minor objection or complaint. Aside from a few hundred teensy-weensy quibbles about the set, the script, the actors, the director, the costumes, the lighting, and the props, the hypercritical critic loved the play. alsoV.	
quiescent	ADJ. at rest; dormant; temporarily inactive. After the great eruption, fear of Mount Etna was great; people did not return to cultivate its rich hillside lands until the volcano had been quiescent for a full two years. quiescence, N.
quietude	N. tranquility. He was impressed by the air of qui¬etude and peace that pervaded the valley.
quintessence	N. purest and highest embodiment. Noel Coward displayed the quintessence of wit.
quip	N. >The awful equipments with which they went to hunt for the monsters were largely quipped by the followers
quirk<br startling twist; caprice. By a quirk of fate, he found himself working for the man whom he had discharged years before.	
quiver	V. tremble; shake. The bird dog's nose twitched and his whiskers quivered as he strained eagerly against the leash. also N.
quixotic	ADJ. idealistic but impractical. Constantly coming up with quixotic, unworkable schemes to save the world, Simon has his heart in the right place, but his head some-where in the clouds.
quizzical	"ADJ. teasing; bantering; mocking; curious. When the skinny teenager tripped over his own feet stepping into the bullpen, Coach raised one quizzical eyebrow, shook his head, and said, ""Okay, kid. You're here, let's see what you've got."""
quorum<br >Until the quorum is reached the forum will not be held	
rabid	ADJ. /suffering from rabies ;like a fanatic; furious. He was a rabid follower of the Dodgers and watched them play whenever he could go to the ball park.
raconteur	N. storyteller. My father was a gifted raconteur with an unlimited supply of anecdotes.
rail	V. >After the railway accident the manager suffered from intense railing
raiment	"N. clothing. ""How can I go to the ball?"" asked Cin¬derella. ""I have no raiment fit to wear."""
rally	V. call up or summon (forces, vital powers, etc.); revive or recuperate. Washington quickly rallied his troops to fight off the British attack. The patient had been sinking throughout the night, but at dawn she rallied and made a complete recovery.
ramble<br wander aimlessly (physically or mentally). Lis¬tening to the teacher ramble, Judy wondered whether he'd ever get to his point.	
ramification	N. branching out; subdivision. We must exam¬ine all the ramifications of this problem.
ramify<br divide into branches or subdivisions. When the plant begins to ramify, it is advisable to nip off most of the new branches.	
ramp	N. >The rampant massacre was to be triggered on a ramp
rampant	ADJ. growing in profusion; unrestrained. The ram¬pant weeds in the garden choked the flowers until they died.
ramshackle<br >Living in that ramshackle house with shackles is no different than committing suicide	
rancid	ADJ. having the odor of stale fat. A rancid odor filled the ship's galley and nauseated the crew.
rancor<br >He related his rancor with much rancous voice	
random	ADJ. without definite purpose, plan, or aim; hap¬hazard. Although the sponsor of the raffle claimed all win¬ners were chosen at random, people had their suspicions when the grand prize went to the sponsor's brother-in-law.
rankle<br >The disparagement from the lower-ranked soldier rankled his soul, leaving him buckled by the interrogations	
rant at<br rave; talk excitedly; scold; make a grandiloquent speech. When he heard that I'd totaled the family car, Dad began to rant at me like a complete madman.	
rapacious	ADJ. >He was not only rapacious, but also rape-greedy
rapport<br >The rapport between them is a result of long-time cooperation in hunting rabbits	
rapt	ADJ. absorbed; enchanted. Caught up in the wonder of the storyteller's tale, the rapt listeners sat motionless, hanging on his every word.
rarefied	ADJ. made less dense (of a gas]. The mountain climbers had difficulty breathing in the rarefied atmosphere. rarefy,V.
raspy<br grating; harsh. The sergeant's raspy voice grated on the recruits' ears.	
ratify	V. >Rationalize
ratiocination	N. reasoning; act of drawing conclusions from premises. While Watson was a man of average intelli¬gence, Holmes was a genius, whose gift for ratiocination made him a superb detective.
rationale	N. >His ration was that the rationals are just rudimentary to the development of that disciplinary
rationalize	V. give a plausible reason for an action in place of a true, less admirable one; offer an excuse. When David told gabby Gabrielle he couldn't give her a ride to the dance because he had no room in the car, he was rational¬izing; actually, he couldn't stand being cooped up in a car with anyone who talked as much as she did.
raucous	ADJ. harsh and shrill; disorderly and boisterous. The raucous crowd of New Year's Eve revelers got progres¬sively noisier as midnight drew near.
rave	N. overwhelmingly favorable review. Though critic John Simon seldom has a good word to say about most contemporary plays, his review of All in the Timing was a total rave.
ravel<br fall apart into tangles; unravel or untwist; entangle. A single thread pulled loose, and the entire scarf started to ravel.	
ravenous	ADJ. extremely hungry. The ravenous dog upset several garbage pails in its search for food.
raze<br >Razed to the ground, the maze can no longer trap anybody	
reactionary<br >Reacionary forces are to be thrown into the garbage bump of history, asshole!	
realm	N. kingdom; field or sphere. In the animal realm, the lion is the king of beasts.
reaper	N. one who harvests grain. Death, the Grim Reaper, cuts down mortal men and women, just as a farmer cuts down the ripened grain. reap,V.
rebuff	V. snub; beat back. She rebuffed his invitation so smoothly that he did not realize he had been snubbed. also N.
rebuke	V. scold harshly; criticize severely. No matter how sharply Miss Watson rebuked Huck for his misconduct, he never talked back but just stood there like a stump. also N.
rebuttal	N. refutation; response with contrary evidence. The defense lawyer confidently listened to the prosecutor sum up his case, sure that she could answer his arguments in her rebuttal.
recalcitrant<br obstinately stubborn; determined to resist authority; unruly. Which animal do you think is more recalci¬trant, a pig or a mule?	
recant<br >Recanting saying cants is something we have to pay attention to	
recapitulate<br summarize. Let us recapitulate what has been said thus far before going ahead.	
recast	V. >Don't cast a doubt. All the sentences and actors are carefully recast again and again
receptive	ADJ. quick or willing to receive ideas, sugges¬tions, etc. Adventure-loving Huck Finn proved a receptive audience for Tom's tales of buried treasure and piracy.
recession	N. withdrawal; retreat; time of low economic activity. The slow recession of the flood waters created problems for the crews working to restore power to the area. recede,V.
recidivism	N. >We consider revising the law for harsher punishments on revidivists
recipient	N. receiver. Although he had been the recipient of many favors, he was not grateful to his benefactor.
reciprocal	ADJ. mutual; exchangeable; interacting. The two nations signed a reciprocal trade agreement.
reciprocate	V. repay in kind. If they attack us, we shall be compelled to reciprocate and bomb their territory. reci¬procity, N.
recluse	N. hermit; loner. Disappointed in love, Miss Emily became a recluse; she shut herself away in her empty man¬sion and refused to see another living soul. reclusive,ADJ.
reconcile	V. correct inconsistencies; become friendly after a quarrel. Each month when we try to reconcile our checkbook with the bank statement, we quarrel. However, despite these monthly lovers' quarrels, we always manage to reconcile.
reconnaissance	N. survey of enemy by soldiers; reconnoi¬tering. If you encounter any enemy soldiers during your reconnaissance, capture them for questioning.
recount	V. narrate or tell; count over again. A born story¬teller, my father loved to recount anecdotes about his early years in New York.
recourse	N. resorting to help when in trouble. The boy's only recourse was to appeal to his father for aid.
recrimination	N. countercharges. Loud and angry recrimi¬nations were her answer to his accusations.
rectify	V. set right; correct. You had better send a check to rectify your account before American Express cancels your credit card.
rectitude	N. >People of rectitude recify others, not get rectified by others
recumbent	ADJ. >Once you become incumbent you become recumbent, true for presidents
recuperate	V. recover. The doctors were worried because the patient did not recuperate as rapidly as they had expected.
recurrent	ADJ. occurring again and again. Richard's recurrent asthma attacks disturbed us and we consulted a physician.
Word List 40	redolent-rescind
redolent	ADJ. fragrant; odorous; suggestive of an odor. Even though it is February, the air is redolent of spring.
redoubtable	ADJ. >There's no doubt that he's a redoubtable warrior
redress	N. remedy; compensation. Do you mean to tell me that I can get no redress for my injuries? also v.
redundant	ADJ. superfluous; repetitious; excessivejy wordy. The bottle of wine I brought to Bob's was certainly redundant how was I to know Bob owned a winery? In your essay, you repeat several points unnecessarily; try to be less redundant in the future. redundancy, N.
reek of	V. emit (odor). The room reeked with stale tobacco smoke. also N.
refraction	N. bending of a ray of light. When you look at a stick inserted in water, it looks bent because of the refrac¬tion of the light by the water.
refractory	ADJ. >Refractory factory workers refused to deal with the refractory metals
refrain	V. abstain from; resist. Whenever he heard a song with a lively chorus, Sol could never refrain from joining in on the refrain.
refurbish	V. renovate; make bright by polishing. The flood left a deposit of mud on everything; we had to refurbish our belongings.
refute	V. disprove. The defense called several respectable witnesses who were able to refute the false testimony of the prosecution's sole witness. refutation, N.
regal	ADJ. royal. Prince Albert had a regal manner.
regale<br >Bale regaled the fans with gale-like performace down the flanks and thus regained reputation	
regime	N. method or system of government. When the French mention the Old Regime, they refer to the govern¬ment existing before the revolution.
regimen	N. prescribed diet and habits. I doubt whether the results warrant our living under such a strict regimen.
rehabilitate<br restore to proper condition. We must reha¬bilitate those whom we send to prison.	
reimburse	V. repay. Let me know what you have spent and I will reimburse you.
reiterate	V. repeat. He reiterated the warning to make sure everyone understood it.
rejoinder	N. >Joining the discussion, Johnson quickly impressed us all with witty rejoinders
rejuvenate	V. make young again. The charlatan claimed that his elixir would rejuvenate the aged and weary.
relegate	V. banish to an inferior position; delegate; assign. After Ralph dropped his second tray of drinks that week, the manager swiftly relegated him to a minor post cleaning up behind the bar.
relent	V. give in. When her stern father would not relent and allow her to marry Robert Browning, Elizabeth Barrett eloped with her suitor. relentless,ADJ.
relevant	ADJ. pertinent; referring to the case in hand. How relevant Virginia Woolf's essays are to women writers today! It's as if Woolf in the 1930s foresaw our current literary struggles. relevancy, N.
relic	N. surviving remnant; memento. Egypt's Department of Antiquities prohibits tourists from taking mummies and other ancient relics out of the country. Mike keeps his photos of his trip to Egypt in a box with other relics of his travels.
relinquish	V. give up something with reluctance; yield. Denise never realized how hard it would be for her to relinquish her newborn son to the care of his adoptive par¬ents. Once you get used to fringe benefits like expense account meals and a company car, it's very hard to relin¬quish them.
relish	"V. savor; enjoy. Watching Peter enthusiastically chow down, I thought, ""Now there's a man who relishes a good dinner!"" also N."
remediable	ADJ. reparable. Let us be grateful that the damage is remediable.
remedial	ADJ. curative; corrective. Because he was a slow reader, he decided to take a course in remedial reading.
reminiscence<br recollection. Her reminiscences of her experiences are so fascinating that she ought to write a book.	
remiss	ADJ. negligent. The guard was accused of being remiss in his duty when the prisoner escaped.
remission<br >The prayer temporarily granted him remission from being remiss in his hallowed duty	
remnant	N. remainder. I suggest that you wait until the store places the remnants of these goods on sale.
remonstrance	N. >Demonstrate
remorse	N. guilt; self-reproach. The murderer felt no remorse for his crime.
remunerative	ADJ. compensating; rewarding. I find my new work so remunerative that I may not return to my previ¬ous employment. remuneration, N.
rend	V. split; tear apart. In his grief, he tried to rend his garments. rent, N.
render	V. deliver; provide; represent. He rendered aid to the needy and indigent.
rendition	N. >That edition of rendition from Karajan really stunned us from inside out
renegade	N. deserter; traitor. Because he had abandoned his post and joined forces with the Indians, his fellow offi¬cers considered the hero of Dances with Wolves a rene¬gade. alsoADJ.
renege<br >That renegade reneged having become a renegade of his motherland	
renounce	V. abandon; disown; repudiate. Even though she knew she would be burned at the stake as a witch, Joan of Arc refused to renounce her belief that her voices came from God. renunciation, N.
renovate	V. restore to good condition; renew. They claim that they can renovate worn shoes so that they look like new ones.
renown	N. fame. For many years an unheralded researcher, Barbara McClintock gained international renown when she won the Nobel Prize in Physiology and Medicine. renowned,ADJ.
rent	N. rip; split. Kit did an excellent job of mending the rent in the lining of her coat.
reparable	ADJ. capable of being repaired. Fortunately, the damages we suffered in the accident were reparable and our car looks brand new.
reparation<br >The reparations are hardly enough for even the tinest repair in Yuanmingyuan	
re'past	N. >Reproach them for having the repast past by their side while not seizing it
repeal	V. revoke; annul. What would the effect on our soci¬ety be if we decriminalized drug use by repealing the laws against the possession and sale of narcotics?
repel	V. drive away; disgust. At first, the Beast's ferocious appearance repelled Beauty, but she came to love the ten¬der heart hidden behind that beastly exterior.
repellent	ADJ. driving away; unattractive. Mosquitoes find the odor so repellent that they leave any spot where this liq¬uid has been sprayed. also N.
repercussion	N. rebound; reverberation; reaction. I am afraid that this unfortunate incident will have serious reper¬cussions.
repertoire<br >The people out from conservatoire became replete with repertoire to perform on stage	
replenish	V. fill up again. Before she could take another backpacking trip, Carla had to replenish her stock of freeze-dried foods.
replete with<br >Replenished himself full with meat, the lion is now replete with meat	
replica	N. copy. Are you going to hang this replica of the Declaration of Independence in the classroom or in the auditorium?
replicate	V. reproduce; duplicate. Because he had always wanted a palace, Donald decided to replicate the Tai Mahal in miniature on his estate.
repository<br>Repose	N. storehouse. Libraries are repositories of the world's best thoughts.
reprehensible<br deserving blame. Shocked by the viciousness of the bombing, politicians of every party uni¬formly condemned the terrorists' reprehensible deed.	
repress	V. restrain; crush; oppress. Anne's parents tried to curb her impetuosity without repressing her boundless high spirits.
reprieve	N. temporary stay. During the twenty-four-hour reprieve, the lawyers sought to make the stay of execution permanent. alsoV.
reprimand	V. reprove severely; rebuke. Every time Ermen¬garde made a mistake in class, she was afraid that Miss Minchin would reprimand her and tell her father how badly she was doing in school. also N.
reprisal	N. retaliation. I am confident that we are ready for any reprisals the enemy may undertake.
reprise<br >The dreadful reprise was actually part of a reprisal aimed at the uncouth audience	
reproach	V. express disapproval or disappointment. He never could do anything wrong without imagining how the look on his mother's face would reproach him afterwards. reproachful,ADJ.
reprobate	N. person hardened in sin, devoid of a sense of decency. I cannot understand why he has so many admir¬ers if he is the reprobate you say he is.
reprove	V. censure; rebuke. The principal severely reproved the students whenever they talked in the halls.
repudiate	V. disown; disavow. On separating from Tony, Tina announced that she would repudiate all debts incurred by her soon-to-be ex-husband.
repugnant	ADJ. loathsome; hateful. She found the snake repugnant and looked on it with loathing and fear.
repulsion	N. distaste; act of driving back. Hating blood¬shed, she viewed war with repulsion. Even defensive bat¬tles distressed her, for the repulsion of enemy forces is never accomplished bloodlessly.
reputable	ADJ. respectable. If you want to buy antiques, look for a reputable dealer; far too many dealers today pass off fakes as genuine antiques.
reputed<br supposed. Though he is the reputed father of the child, no one can be sure. repute, N.	
requiem	N. mass for the dead; dirge. They played Mozart's Requiem at the funeral.
requisite	N. necessary requirement. Many colleges state that a student must offer three years of a language as a requisite for admission.
requite	V. repay; revenge. The wretch requited his bene¬factors by betraying them.
rescind	V. >Remniscient
Word List 41	resentment-sacrosanct
resentment	N. indignation; bitterness; displeasure. Not wanting to appear a sore loser, Bill tried to hide his resent¬ment of Barry's success.
reserve	N. self-control; formal but distant manner. Although some girls were attracted by Mark's air of reserve, Judy was put off by it, for she felt his aloofness indicated a lack of openness. reserved,ADJ.
residue	N. remainder; balance. In his will, he requested that after payment of debts, taxes, and funeral expenses, the residue be given to his wife. residual,ADJ.
resigned	ADJ. accepting one's fate; unresisting; patiently submissive. Resigned to his downtrodden existence, Bob Cratchit was too meek to protest Scrooge's bullying. resig¬nation, N.
resilient<br elastic; having the power of springing back. Highly resilient, steel makes excellent bedsprings. resilience, N.	
resolution	N. determination; resolve. Nothing could shake his resolution that his children would get the best education that money could buy. resolute,ADJ.
resolve	N. determination; firmness of purpose. How dare you question my resolve to take up sky-diving! Of course I haven't changed my mind!
resonant	ADJ. echoing; resounding; deep and full in sound. The deep, resonant voice of the actor James Earl Jones makes him particularly effective when he appears on stage.
respiration	N. breathing; exhalation. The doctor found that the patient's years of smoking had adversely affected both his lung capacity and his rate of respiration.
respite	N. >Spite
resplendent<br dazzling; glorious; brilliant. While all the adults were commenting how glorious the emperor looked in his resplendent new clothes, one little boy was heard to say, &quot;But he's naked!&quot;	
responsiveness	N. state of reacting readily to appeals, orders, etc. The audience cheered and applauded, delight¬ing the performers by its responsiveness.
