complacency	N. self-satisfaction; smugness. Full of com¬placency about his latest victories, he looked smugly at the row of trophies on his mantelpiece. complacent,ADJ.
complaisant<br trying to please; obliging. The courtier obeyed the king's orders in a complaisant manner.	
complement	V. complete; consummate; make perfect. The waiter recommended a glass of port to complement the cheese. also N.
*complementary	ADJ. serving to complete something. John and Lisa's skills are complementary. he's good at following a daily routine, while she's great at improvising and han¬dling emergencies. Together they make a great team.
compliance	N. readiness to yield; conformity in fulfilling requirements. Bullheaded Bill was not noted for easy com¬pliance with the demands of others. As an architect, how¬ever, Bill recognized that his design for the new school had to be in compliance with the local building code.
compliant	ADJ. yielding. Because Joel usually gave in and went along with whatever his friends desired, his mother worried that he might be too compliant.
complicity	N. participation; involvement. You cannot keep your complicity in this affair secret very long; you would be wise to admit your involvement immediately.
component	N. element; ingredient. I wish all the compo¬nents of my stereo system were working at the same time.
composure	N. mental calmness. Even the latest work crisis failed to shake her composure.
compound	V. combine; constitute; pay interest; increase. The makers of the popular cold remedy compounded a nasal decongestant with an antihistamine. also N.
comprehensive	ADJ. thorough; inclusive. This book pro¬vides a comprehensive review of verbal and math skills for the SAT.
compress	V. close; squeeze; contract. She compressed the package under her arm.
comprise	V. include; consist of. If the District of Columbia were to be granted statehood, the United States of America would comprise fifty-one states, not just fifty.
compromise	V. adjust or settle by making mutual conces¬sions; endanger the interests or reputation of. Sometimes the presence of a neutral third party can help adversaries compromise their differences. Unfortunately, you're not neu¬tral; therefore, your presence here compromises our chances of reaching an agreement. also N.
compunction	N. remorse. The judge was especially severe in his sentencing because he felt that the criminal had shown no compunction for his heinous crime.
compute	V. reckon; calculate. He failed to compute the interest, so his bank balance was not accurate. computa¬tion, N.
concave	ADJ. hollow. The back-packers found partial shel¬ter from the storm by huddling against the concave wall of the cliff.
concede	V. admit; yield. Despite all the evidence Monica had assembled, Mark refused to concede that she was right.
conceit	N. vanity or self-love; whimsical idea; extravagant metaphor. Although Jack was smug and puffed up with conceit, he was an entertaining companion, always expressing himself in amusing conceits and witty turns of phrase.
concentric	ADJ. having a common center. The target was made of concentric circles.
conception	N. forming of an idea. idea. fertilization. At the first conception of the work, he was consulted. conceive,V.
concerted	ADJ. mutually agreed on; done together. All the Girl Scouts made a concerted effort to raise funds for their annual outing. When the movie star appeared, his fans let out a concerted sigh.
concession	N. an act of yielding. Before they could reach an agreement, both sides had to make certain concessions.
conciliatory	ADJ. /reconciling; soothing. She was still angry despite his conciliatory words. conciliate,V.
concise	ADJ. brief and compact. When you define a new word, be concise: the shorter the definition, the easier it is to remember.
contrived	ADJ. forced; artificial; not spontaneous. Feeling ill at ease with his new in-laws, James made a few contrived attempts at conversation and then retreated into silence.
controvert	V. oppose with arguments; attempt to refute; contradict. The witness's testimony was so clear and her reputation for honesty so well-established that the defense attorney decided it was wiser to make no attempt to contro¬vertwhat she said.
contusion	N. bruise. Black and blue after her fall, Sue was treated for contusions and abrasions.
conundrum	N. riddle. During the long car ride, she invented conundrums to entertain the children.
convene	V. assemble. Because much needed legislation had to be enacted, the governor ordered the legislature to convene in special session by January 15.
convention	N. social or moral custom; established prac¬tice. Flying in the face of convention, George Sand shocked society by taking lovers and wearing men's clothes.
conventional	ADJ. ordinary; typical. His conventional upbringing left him wholly unprepared for his wife's eccen¬tric family.
converge	V. approach; tend to meet; come together. African-American men from all over the United States con¬verged on Washington to take part in the historic Million Men march.
conversant	ADJ. familiar with. The lawyer is conversant with all the evidence.
converse<br opposite. The inevitable converse of peace is not war but annihilation.	
convert	N. one who has adopted a different religion or opinion. On his trip to Japan, though the President spoke at length about the virtues of American automobiles, he made few converts to his beliefs. alsoV.
convex<br curving outward. He polished the convex lens of his telescope.	
conveyance	N. vehicle; transfer. During the transit strike, commuters used various kinds of conveyances.
conviction<br judgment that someone is guilty of a crime; strongly held belief. Even her conviction for murder did not shake Peter's conviction that Harriet was innocent of the crime.	
convivial	ADJ. /festive; gay; characterized by joviality. The convivial celebrators of the victory sang their college songs.
convoke	V. call together. Congress was convoked at the outbreak of the emergency. convocation, N.
convoluted	ADJ. coiled around; involved; intricate. His argument was so convoluted that few of us could follow it intelligently.
Copious	ADJ. plentiful. She had copious reasons for reject¬ing the proposal.
coquette	N. flirt. Because she refused to give him an answer to his proposal of marriage, he called her a coquette. alsoV.
cordial	ADJ. gracious; heartfelt. Our hosts greeted us at the airport with a cordial welcome and a hearty hug.
cordon	N. extended line of men or fortifications to prevent access or egress. The police cordon was so tight that the criminals could not leave the area. alsoV.
cornucopia	N. horn overflowing with fruit and grain; symbol of abundance. The encyclopedia salesman claimed the new edition was a veritable cornucopia of information, an inexhaustible source of knowledge for the entire family.
corollary	N. consequence; accompaniment. Brotherly love is a complex emotion, with sibling rivalry its natural corollary.
coronation	N. ceremony of crowning a queen or king. When the witches told Macbeth he would be king, they failed to warn him he would lose his crown soon after his coronation.
corporeal	ADJ. bodily; material. The doctor had no patience with spiritual matters: his job was to attend to his patients' corporeal problems, not to minister to their souls.
corpulent	ADJ. very fat. The corpulent man resolved to reduce. corpulence, N.
correlation	N. mutual relationship. He sought to determine the correlation that existed between ability in algebra and ability to interpret reading exercises. correlate, V., N.
corroborate	V. confirm; support. Though Huck was quite willing to corroborate Tom's story, Aunt Polly knew better than to believe either of them.
corrode	V. destroy by chemical action. The girders support¬ing the bridge corroded so gradually that no one suspected any danger until the bridge suddenly collapsed. corrosion, N.
corrosive	ADJ. eating away by chemicals or disease. Stain¬less steel is able to withstand the effects of corrosive chem¬icals. corrode,V.
corrugated	ADJ. wrinkled; ridged. She wished she could smooth away the wrinkles from his corrugated brow.
Cosmic	ADJ. pertaining to the universe; vast. Cosmic rays derive their name from the fact that they bombard the earth's atmosphere from outer space. COSMOS, N.
cosmopolitan	Largely inaccurate explanation...<br >
coterie	N. group that meets socially; select circle. After his book had been published, he was invited to join the literary coterie that lunched daily at the hotel.
countenance	V. approve; tolerate. He refused to counte¬nance such rude behavior on their part.
countermand	V. cancel; revoke. The general counter¬manded the orders issued in his absence.
culvert<br artificial channel for water. If we build a culvert under the road at this point, we will reduce the possibility of the road's being flooded during the rainy season.	
cumbersome	ADJ. heavy; hard to manage. He was bur¬dened down with cumbersome parcels.
cumulative	ADJ. growing by addition. Vocabulary building is a cumulative process: as you go through your flash cards, you will add new words to your vocabulary, one by one.
cupidity	N. greed. The defeated people could not satisfy the cupidity of the conquerors, who demanded excessive tribute. cupi has cupidity
curator	N. superintendent; manager. The members of the board of trustees of the museum expected the new curator to plan events and exhibitions that would make the museum more popular.
curmudgeon	N. /churlish, miserly individual. Although he was regarded by many as a curmudgeon, a few of us were aware of the many kindnesses and acts of charity that he secretly performed.
cursive	ADJ. flowing, running. In normal writing we run our letters together in cursive form; in printing, we separate the letters.
cursory	ADJ. /casual; hastily done. Because a cursory examination of the ruins indicates the possibility of arson, we believe the insurance agency should undertake a more extensive investigation of the fire's cause.
curtail	V. shorten; reduce. When Herb asked Diane for a date, she said she was really sorry she couldn't go out with him, but her dad had ordered her to curtail her social life.
cynical	"ADJ. skeptical or distrustful of human motives. Cyn¬ical from birth, Sidney was suspicious whenever anyone gave him a gift ""with no strings attached."" cynic, N."
cynosure	N. the object of general attention. As soon as the movie star entered the room, she became the cynosure of all eyes.
dabble	V. work at in a non-serious fashion; splash around. The amateur painter dabbled at art, but seldom produced a finished piece. The children dabbled their hands in the bird bath, splashing one another gleefully.
dais	N. raised platform for guests of honor. When he approached the dais, he was greeted by cheers from the people who had come to honor him.
dank	ADJ. damp. The walls of the dungeon were dank and slimy.
dapper	"ADJ. neat and trim. In ""The Odd Couple"" TV show, Tony Randall played Felix Unger, an excessively dapper soul who could not stand to have a hair out of place."
dappled	ADJ. spotted. The sunlight filtering through the screens created a dappled effect on the wall.
daub	V. smear (as with paint). From the way he daubed his paint on the canvas, I could tell he knew nothing of oils. also N.
daunt	"V. intimidate; frighten. ""Boast all you like of your prowess. Mere words cannot daunt me,"" the hero answered the villain."
dauntless	ADJ. bold. Despite the dangerous nature of the undertaking, the dauntless soldier volunteered for the assignment.
dawdle	V. loiter; waste time. We have to meet a deadline so don't dawdle; just get down to work.
deadlock	N. standstill; stalemate. Because negotiations had reached a deadlock, some of the delegates had begun to mutter about breaking off the talks. alsoV.
deadpan	ADJ. wooden; impersonal. We wanted to see how long he could maintain his deadpan expression.
dearth	N. scarcity. The dearth of skilled labor compelled the employers to open trade schools.
debacle	N. sudden downfall; complete disaster. In the Air¬plane movies, every flight turns into a debacle, with passen¬gers and crew members collapsing, engines falling apart, and carry-on baggage popping out of the overhead bins.
debase	V. reduce in quality or value; lower in esteem; degrade. In The King and l, Anna refuses to kneel down and prostrate herself before the king, for she feels that to do so would debase her position, and she will not submit to such debasement.
debauch	V. corrupt; seduce from virtue. Did Socrates' teachings lead the young men of Athens to be virtuous citi¬zens, or did they debauch the young men, causing them to question the customs of their fathers? Clearly, Socrates' philosophical talks were nothing like the wild debauchery of the toga parties in Animal House.
debilitate	V. weaken; enfeeble. Michael's severe bout of the flu debilitated him so much that he was too tired to go to work for a week.
debonair	ADJ. /positive friendly; aiming to please. The debonair youth was liked by all who met him, because of his cheerful and obliging manner.
debris	N. rubble. A full year after the earthquake in Mexico City, they were still carting away the debris.
debunk	V. expose as false, exaggerated, worthless, etc; ridicule. Pointing out that he consistently had voted against strengthening anti-pollution legislation, reporters debunked the candidate's claim that he was a fervent environmentalist.
debutante	N. young woman making formal entrance into society. As a debutante, she was often mentioned in the society columns of the newspapers.
decadence	N. decay. The moral decadence of the people was reflected in the lewd literature of the period.
decapitate	"V. behead. They did not hang Lady Jane Grey; they decapitated her. ""Off with her head!"" cried the Duchess, eager to decapitate poor Alice."
decelerate	V. slow down. Seeing the emergency blinkers in the road ahead, he decelerated quickly.
Word List 13 deciduous-dermatologist	...
deciduous	ADJ. falling off as of leaves. The oak is a decid¬uous tree; in winter it looks quite bare.
decimate	V. kill, usually one out of ten. We do more to decimate our population in automobile accidents than we do in war.
decipher	V. interpret secret code. Lacking his code book, the spy was unable to decipher the scrambled message sent to him from the KGB.
declivity	N. downward slope. The children loved to ski down the declivity.
decollete	ADJ. having a low-necked dress. Current fashion decrees that evening gowns be decollete this season; bare shoulders are again the vogue.
decomposition	N. decay. Despite the body's advanced state of decomposition, the police were able to identify the murdered man.
decorum	N. propriety; orderliness and good taste in man¬ners. Even the best-mannered students have trouble behav¬ing with decorum on the last day of school. decorous,ADJ.
decoy	N. lure or bait. The wild ducks were not fooled by the decoy. alsoV.
decrepit	ADJ. worn out by age. The decrepit car fell off the road, blocking traffic on the highway.
decrepitude	N. state of collapse caused by illness or old age. I was unprepared for the state of decrepitude in which I had found my old friend; he seemed to have aged twenty years in six months.
decry	V. express strong disapproval of; disparage. The founder of the Children's Defense Fund, Marian Wright Edelman, strongly decries the lack of financial and moral support for children in America today.
deducible	ADJ. derived by reasoning. If we accept your premise, your conclusions are easily deducible.
deface	V. mar; disfigure. If you deface a library book, you will have to pay a hefty fine.
defame	V. harm someone's reputation; malign; slander. If you try to defame my good name, my lawyers will see you in court. If rival candidates persist in defaming one another, the voters may conclude that all politicians are crooks. defamation, N.
default	N. failure to act. When the visiting team failed to show up for the big game, they lost the game by default. When Jack failed to make the payments on his Jaguar, the dealership took back the car because he had defaulted on his debt.
defeatist	ADJ. attitude of one who is ready to accept defeat as a natural outcome. If you maintain your defeatist attitude, you will never succeed. also N.
defection<br desertion. The children, who had made him an idol, were hurt most by his defection from our cause.	
defer	V. delay till later; exempt temporarily. In wartime, some young men immediately volunteer to serve; others
deference	N. courteous regard for another's wish. In defer¬ence to the minister's request, please do not take pho¬tographs during the wedding service.
defiance	"N. refusal to yield; resistance. When John reached the ""terrible two's,"" he responded to every parental request with howls of defiance. defy,V."
defile	V. pollute; profane. The hoodlums defiled the church with their scurrilous writing.
definitive	ADJ. final; complete. Carl Sandburg's Abraham Lincoln may be regarded as the definitive work on the life of the Great Emancipator.
deflect	V. turn aside. His life was saved when his cigarette case deflected the bullet.
defoliate	V. /destroy leaves. In Vietnam the army made extensive use of chemical agents to defoliate the woodlands.
defray	V. pay the costs of. Her employer offered to defray the costs of her postgraduate education.
deft	ADJ. neat; skillful. The deft waiter uncorked the cham¬pagne without spilling a drop.
defunct	ADJ. dead; no longer in use or existence. The lawyers sought to examine the books of the defunct corpo¬ration.
defuse<br remove the fuse of a bomb; reduce or eliminate a threat. Police negotiators are trained to defuse danger¬ous situations by avoiding confrontational language and behavior.	
degenerate	V. become worse; deteriorate. As the fight dragged on, the champion's style degenerated until he could barely keep on his feet.
degradation	N. humiliation; debasement; degeneration. Some secretaries object to fetching the boss a cup of cof¬fee because they resent the degradation of being made to do such lowly tasks. degrade,V.
dehydrate	V. remove water from; dry out. Running under a hot sun quickly dehydrates the body; joggers soon learn to carry water bottles and to drink from them frequently.
deify	V.  turn into a god; idolize. Admire Elvis Presley all you want; just don't deify him.
deign	V./condescend; stoop. The celebrated fashion designer would not deign to speak to a mere seamstress; his overburdened assistant had to convey the master's wishes to the lowly workers assembling his great designs.
delectable	ADJ. >the software was just so delectable that we couldn't stand to delete it
delete	V. erase; strike out. Less is more: if you delete this paragraph, your whole essay will have greater appeal.
deleterious	ADJ. harmful. If you believe that smoking is deleterious to your health (and the Surgeon General cer¬tainly does), then quit!
deliberate	V. consider; ponder. Offered the new job, she asked for time to deliberate before she told them her decision,
delineate	V. portray; depict; sketch. Using only a few descriptive phrases, Austen delineates the character of Mr. Collins so well that we can predict his every move. delin¬eation, N.
delirium	N. mental disorder marked by confusion. In his delirium, the drunkard saw pink panthers and talking pigs. Perhaps he wasn't delirious: he might just have wandered into a movie.
delude	V. deceive. His mistress may have deluded herself into believing that he would leave his wife and marry her.
deluge	N. flood; rush. When we advertised the position, we received a deluge of applications.
delusion	N. false belief; hallucination. Don suffers from delusions of grandeur: he thinks he's a world-famous author when he's published just one paperback book.
delve	V. dig; investigate. Delving into old books and man¬uscripts is part of a researcher's job.
demagogue	N. person who appeals to people's prejudice; false leader of people. He was accused of being a dema¬gogue because he made promises that aroused futile hopes in his listeners.
demean	V. degrade; humiliate. Standing on his dignity, he refused to demean himself by replying to the offensive letter. If you truly believed in the dignity of labor, you would not think it would demean you to work as a janitor.
demeanor	N. behavior; bearing. His sober demeanor qui¬eted the noisy revelers.
demented	ADJ. insane. Doctor Demento was a lunatic radio personality who liked to act as if he were truly demented. If you're demented, your mental state is out of whack; in other words, you're wacky.
demise	N. death. Upon the demise of the dictator, a bitter dispute about succession to power developed.
demolition	N. destruction. One of the major aims of the air force was the complete demolition of all means of trans¬portation by bombing of rail lines and terminals. demolish,V.
demoniac	ADJ. fiendish. The Spanish Inquisition devised many demoniac means of torture. demon, N.
demur	V. object (because of doubts, scruples); hesitate. When offered a post on the board of directors, David demurred: he had scruples about taking on the job because he was unsure he could handle it in addition to his other responsibilities.
demure	ADJ. grave; serious; coy. She was demure and reserved, a nice modest girl whom any young man would be proud to take home to his mother.
demystify	V. clarify; free from mystery or obscurity. Help¬ful doctors demystify medical procedures by describing them in everyday language, explaining that a myringotomy, for example, is an operation involving making a small hole in one's eardrum.
denigrate	V. blacken. All attempts to denigrate the charac¬ter of our late president have failed; the people still love him and cherish his memory.
denizen	N. inhabitant or resident; regular visitor. In The Untouchables, Eliot Ness fights AI Capone and the other denizens of Chicago's underworld. Ness's fight against cor¬ruption was the talk of all the denizens of the local bars.
denotation	"N. Nit yo be confused with ""detonate""<br />meaning; distinguishing by name. A dictio¬nary will always give us the denotation of a word; fre¬quently, it will also give us the connotations. denote,V."
denouement	N. outcome; final development of the plot of a play. The play was childishly written; the denouement was obvious to sophisticated theatergoers as early as the mid¬dle of the first act.
denounce	V. /condemn; criticize;tell the authority. The reform candidate denounced the corrupt city officers for having betrayed the public's trust. denunciation, N.
depict	V. portray. In this sensational exposé, the author depicts Beatle John Lennon as a drug-crazed neurotic. Do you question the accuracy of this depiction of Lennon?
deplete	V. reduce; exhaust. We must wait until we deplete our present inventory before we order replacements.
deplore	V. regret; disapprove of. Although I deplore the vulgarity of your language, I defend your right to express yourself freely.
deploy	V. spread out [troops] in an extended though shal¬low battle line. The general ordered the battalion to deploy in order to meet the enemy offensive.
depose	V. dethrone; remove from office. The army attempted to depose the king and set up a military govern¬ment.
deposition	N. >Under deposition they deposed the ruler
depravity	N. extreme corruption; wickedness. The deprav¬ity of Caligula's behavior came to sicken even those who had willingly participated in his earlier, comparatively inno¬cent orgies.
deprecate	V. express disapproval of; protest against; belit¬tle. A firm believer in old-fashioned courtesy, Miss Post deprecated the modern tendency to address new acquain¬tances by their first names. deprecatory,ADJ.
depreciate	V. lessen in value. If you neglect this property, it will depreciate.
depredation	N. plundering. After the depredations of the invaders, the people were penniless.
deranged	ADJ. /insane. He had to be institutionalized because he was mentally deranged.
derelict	ADJ. abandoned; negligent. The derelict craft was a menace to navigation. Whoever abandoned it in the mid¬dle of the harbor was derelict in living up to his responsibili¬ties as a boat owner. also N.
deride	V. ridicule; make fun of. The critics derided his pre¬tentious dialogue and refused to consider his play seri¬ously. derision, N.
derivative	ADJ. unoriginal; derived from another source. Although her early poetry was clearly derivative in nature,the critics thought she had promise and eventually would find her own voice.
dermatologist	N. one who studies the skin and its diseases. I advise you to consult a dermatologist about your acne.
Word List 14 derogatory-disgruntle	...
derogatory	ADJ. expressing a low opinion. I resent your derogatory remarks.
descant upon	V. discuss fully. He was willing to descant upon any topic of conversation, even when he knew very little about the subject under discussion. also N.
descry	V. catch sight of. In the distance, we could barely descry the enemy vessels.
desecrate<br profane; violate the sanctity of. Shattering the altar and trampling the holy objects underfoot, the invaders desecrated the sanctuary.	
desiccate	V. dry up. A tour of this smokehouse will give you an idea of how the pioneers used to desiccate food in order to preserve it.
desolate	ADJ. unpopulated. After six months in the crowded, bustling metropolis, David was so sick of people that he was ready to head for the most desolate patch of wilderness he could find.
despise	V. look on with scorn; regard as worthless or distasteful. Mr. Bond, I despise spies; I look down on them as mean, despicable, honorless men, whom I would wipe from the face of the earth with as little con¬cern as I would scrape dog droppings from the bottom of my shoe.
despoil	V. plunder. If you do not yield, I am afraid the enemy will despoil the countryside.
